No.     Time           Source                Destination           Protocol 
      1 0.000000000    95.213.4.195          192.168.137.253       TLSv1.2

Frame 1: 424 bytes on wire (3392 bits), 424 bytes captured (3392 bits) on interface 0
Ethernet II, Src: 16:2f:68:6c:fc:56 (16:2f:68:6c:fc:56), Dst: Apple_bb:b5:24 (9c:f3:87:bb:b5:24)
Internet Protocol Version 4, Src: 95.213.4.195 (95.213.4.195), Dst: 192.168.137.253 (192.168.137.253)
Transmission Control Protocol, Src Port: 443 (443), Dst Port: 58368 (58368), Seq: 1, Ack: 1, Len: 358
Secure Sockets Layer

No.     Time           Source                Destination           Protocol 
      2 0.000099000    192.168.137.253       95.213.4.195          TCP

Frame 2: 66 bytes on wire (528 bits), 66 bytes captured (528 bits) on interface 0
Ethernet II, Src: Apple_bb:b5:24 (9c:f3:87:bb:b5:24), Dst: 16:2f:68:6c:fc:56 (16:2f:68:6c:fc:56)
Internet Protocol Version 4, Src: 192.168.137.253 (192.168.137.253), Dst: 95.213.4.195 (95.213.4.195)
Transmission Control Protocol, Src Port: 58368 (58368), Dst Port: 443 (443), Seq: 1, Ack: 359, Len: 0

No.     Time           Source                Destination           Protocol 
      3 0.396862000    192.168.137.253       95.213.4.195          TLSv1.2

Frame 3: 1066 bytes on wire (8528 bits), 1066 bytes captured (8528 bits) on interface 0
Ethernet II, Src: Apple_bb:b5:24 (9c:f3:87:bb:b5:24), Dst: 16:2f:68:6c:fc:56 (16:2f:68:6c:fc:56)
Internet Protocol Version 4, Src: 192.168.137.253 (192.168.137.253), Dst: 95.213.4.195 (95.213.4.195)
Transmission Control Protocol, Src Port: 58368 (58368), Dst Port: 443 (443), Seq: 1, Ack: 359, Len: 1000
Secure Sockets Layer

No.     Time           Source                Destination           Protocol 
      4 0.408414000    95.213.4.195          192.168.137.253       TCP

Frame 4: 66 bytes on wire (528 bits), 66 bytes captured (528 bits) on interface 0
Ethernet II, Src: 16:2f:68:6c:fc:56 (16:2f:68:6c:fc:56), Dst: Apple_bb:b5:24 (9c:f3:87:bb:b5:24)
Internet Protocol Version 4, Src: 95.213.4.195 (95.213.4.195), Dst: 192.168.137.253 (192.168.137.253)
Transmission Control Protocol, Src Port: 443 (443), Dst Port: 58368 (58368), Seq: 359, Ack: 1001, Len: 0

No.     Time           Source                Destination           Protocol 
      5 0.409517000    95.213.4.195          192.168.137.253       TLSv1.2

Frame 5: 429 bytes on wire (3432 bits), 429 bytes captured (3432 bits) on interface 0
Ethernet II, Src: 16:2f:68:6c:fc:56 (16:2f:68:6c:fc:56), Dst: Apple_bb:b5:24 (9c:f3:87:bb:b5:24)
Internet Protocol Version 4, Src: 95.213.4.195 (95.213.4.195), Dst: 192.168.137.253 (192.168.137.253)
Transmission Control Protocol, Src Port: 443 (443), Dst Port: 58368 (58368), Seq: 359, Ack: 1001, Len: 363
Secure Sockets Layer

No.     Time           Source                Destination           Protocol 
      6 0.409642000    192.168.137.253       95.213.4.195          TCP

Frame 6: 66 bytes on wire (528 bits), 66 bytes captured (528 bits) on interface 0
Ethernet II, Src: Apple_bb:b5:24 (9c:f3:87:bb:b5:24), Dst: 16:2f:68:6c:fc:56 (16:2f:68:6c:fc:56)
Internet Protocol Version 4, Src: 192.168.137.253 (192.168.137.253), Dst: 95.213.4.195 (95.213.4.195)
Transmission Control Protocol, Src Port: 58368 (58368), Dst Port: 443 (443), Seq: 1001, Ack: 722, Len: 0

No.     Time           Source                Destination           Protocol 
      7 1.348825000    192.168.137.253       8.8.8.8               DNS

Frame 7: 81 bytes on wire (648 bits), 81 bytes captured (648 bits) on interface 0
Ethernet II, Src: Apple_bb:b5:24 (9c:f3:87:bb:b5:24), Dst: 16:2f:68:6c:fc:56 (16:2f:68:6c:fc:56)
Internet Protocol Version 4, Src: 192.168.137.253 (192.168.137.253), Dst: 8.8.8.8 (8.8.8.8)
User Datagram Protocol, Src Port: 55493 (55493), Dst Port: 53 (53)
Domain Name System (query)

No.     Time           Source                Destination           Protocol 
      8 1.395222000    192.168.137.253       95.213.4.195          TLSv1.2

Frame 8: 1066 bytes on wire (8528 bits), 1066 bytes captured (8528 bits) on interface 0
Ethernet II, Src: Apple_bb:b5:24 (9c:f3:87:bb:b5:24), Dst: 16:2f:68:6c:fc:56 (16:2f:68:6c:fc:56)
Internet Protocol Version 4, Src: 192.168.137.253 (192.168.137.253), Dst: 95.213.4.195 (95.213.4.195)
Transmission Control Protocol, Src Port: 58368 (58368), Dst Port: 443 (443), Seq: 1001, Ack: 722, Len: 1000
Secure Sockets Layer

No.     Time           Source                Destination           Protocol 
      9 1.408454000    8.8.8.8               192.168.137.253       DNS

Frame 9: 177 bytes on wire (1416 bits), 177 bytes captured (1416 bits) on interface 0
Ethernet II, Src: 16:2f:68:6c:fc:56 (16:2f:68:6c:fc:56), Dst: Apple_bb:b5:24 (9c:f3:87:bb:b5:24)
Internet Protocol Version 4, Src: 8.8.8.8 (8.8.8.8), Dst: 192.168.137.253 (192.168.137.253)
User Datagram Protocol, Src Port: 53 (53), Dst Port: 55493 (55493)
Domain Name System (response)

No.     Time           Source                Destination           Protocol 
     10 1.410008000    192.168.137.253       54.192.97.234         TCP

Frame 10: 78 bytes on wire (624 bits), 78 bytes captured (624 bits) on interface 0
Ethernet II, Src: Apple_bb:b5:24 (9c:f3:87:bb:b5:24), Dst: 16:2f:68:6c:fc:56 (16:2f:68:6c:fc:56)
Internet Protocol Version 4, Src: 192.168.137.253 (192.168.137.253), Dst: 54.192.97.234 (54.192.97.234)
Transmission Control Protocol, Src Port: 58832 (58832), Dst Port: 443 (443), Seq: 0, Len: 0

No.     Time           Source                Destination           Protocol 
     11 1.443072000    54.192.97.234         192.168.137.253       TCP

Frame 11: 74 bytes on wire (592 bits), 74 bytes captured (592 bits) on interface 0
Ethernet II, Src: 16:2f:68:6c:fc:56 (16:2f:68:6c:fc:56), Dst: Apple_bb:b5:24 (9c:f3:87:bb:b5:24)
Internet Protocol Version 4, Src: 54.192.97.234 (54.192.97.234), Dst: 192.168.137.253 (192.168.137.253)
Transmission Control Protocol, Src Port: 443 (443), Dst Port: 58832 (58832), Seq: 0, Ack: 1, Len: 0

No.     Time           Source                Destination           Protocol 
     12 1.443203000    192.168.137.253       54.192.97.234         TCP

Frame 12: 66 bytes on wire (528 bits), 66 bytes captured (528 bits) on interface 0
Ethernet II, Src: Apple_bb:b5:24 (9c:f3:87:bb:b5:24), Dst: 16:2f:68:6c:fc:56 (16:2f:68:6c:fc:56)
Internet Protocol Version 4, Src: 192.168.137.253 (192.168.137.253), Dst: 54.192.97.234 (54.192.97.234)
Transmission Control Protocol, Src Port: 58832 (58832), Dst Port: 443 (443), Seq: 1, Ack: 1, Len: 0

No.     Time           Source                Destination           Protocol 
     13 1.443263000    192.168.137.253       54.192.97.234         TLSv1

Frame 13: 166 bytes on wire (1328 bits), 166 bytes captured (1328 bits) on interface 0
Ethernet II, Src: Apple_bb:b5:24 (9c:f3:87:bb:b5:24), Dst: 16:2f:68:6c:fc:56 (16:2f:68:6c:fc:56)
Internet Protocol Version 4, Src: 192.168.137.253 (192.168.137.253), Dst: 54.192.97.234 (54.192.97.234)
Transmission Control Protocol, Src Port: 58832 (58832), Dst Port: 443 (443), Seq: 1, Ack: 1, Len: 100
Secure Sockets Layer

No.     Time           Source                Destination           Protocol 
     14 1.444239000    95.213.4.195          192.168.137.253       TCP

Frame 14: 66 bytes on wire (528 bits), 66 bytes captured (528 bits) on interface 0
Ethernet II, Src: 16:2f:68:6c:fc:56 (16:2f:68:6c:fc:56), Dst: Apple_bb:b5:24 (9c:f3:87:bb:b5:24)
Internet Protocol Version 4, Src: 95.213.4.195 (95.213.4.195), Dst: 192.168.137.253 (192.168.137.253)
Transmission Control Protocol, Src Port: 443 (443), Dst Port: 58368 (58368), Seq: 722, Ack: 2001, Len: 0

No.     Time           Source                Destination           Protocol 
     15 1.480198000    54.192.97.234         192.168.137.253       TCP

Frame 15: 66 bytes on wire (528 bits), 66 bytes captured (528 bits) on interface 0
Ethernet II, Src: 16:2f:68:6c:fc:56 (16:2f:68:6c:fc:56), Dst: Apple_bb:b5:24 (9c:f3:87:bb:b5:24)
Internet Protocol Version 4, Src: 54.192.97.234 (54.192.97.234), Dst: 192.168.137.253 (192.168.137.253)
Transmission Control Protocol, Src Port: 443 (443), Dst Port: 58832 (58832), Seq: 1, Ack: 101, Len: 0

No.     Time           Source                Destination           Protocol 
     16 1.490526000    54.192.97.234         192.168.137.253       TLSv1

Frame 16: 1434 bytes on wire (11472 bits), 1434 bytes captured (11472 bits) on interface 0
Ethernet II, Src: 16:2f:68:6c:fc:56 (16:2f:68:6c:fc:56), Dst: Apple_bb:b5:24 (9c:f3:87:bb:b5:24)
Internet Protocol Version 4, Src: 54.192.97.234 (54.192.97.234), Dst: 192.168.137.253 (192.168.137.253)
Transmission Control Protocol, Src Port: 443 (443), Dst Port: 58832 (58832), Seq: 1, Ack: 101, Len: 1368
Secure Sockets Layer

No.     Time           Source                Destination           Protocol 
     17 1.490531000    54.192.97.234         192.168.137.253       TLSv1

Frame 17: 1434 bytes on wire (11472 bits), 1434 bytes captured (11472 bits) on interface 0
Ethernet II, Src: 16:2f:68:6c:fc:56 (16:2f:68:6c:fc:56), Dst: Apple_bb:b5:24 (9c:f3:87:bb:b5:24)
Internet Protocol Version 4, Src: 54.192.97.234 (54.192.97.234), Dst: 192.168.137.253 (192.168.137.253)
Transmission Control Protocol, Src Port: 443 (443), Dst Port: 58832 (58832), Seq: 1369, Ack: 101, Len: 1368
[2 Reassembled TCP Segments (2588 bytes): #16(1306), #17(1282)]
Secure Sockets Layer

No.     Time           Source                Destination           Protocol 
     18 1.490532000    54.192.97.234         192.168.137.253       TLSv1

Frame 18: 325 bytes on wire (2600 bits), 325 bytes captured (2600 bits) on interface 0
Ethernet II, Src: 16:2f:68:6c:fc:56 (16:2f:68:6c:fc:56), Dst: Apple_bb:b5:24 (9c:f3:87:bb:b5:24)
Internet Protocol Version 4, Src: 54.192.97.234 (54.192.97.234), Dst: 192.168.137.253 (192.168.137.253)
Transmission Control Protocol, Src Port: 443 (443), Dst Port: 58832 (58832), Seq: 2737, Ack: 101, Len: 259
[2 Reassembled TCP Segments (336 bytes): #17(86), #18(250)]
Secure Sockets Layer
Secure Sockets Layer

No.     Time           Source                Destination           Protocol 
     19 1.490661000    192.168.137.253       54.192.97.234         TCP

Frame 19: 66 bytes on wire (528 bits), 66 bytes captured (528 bits) on interface 0
Ethernet II, Src: Apple_bb:b5:24 (9c:f3:87:bb:b5:24), Dst: 16:2f:68:6c:fc:56 (16:2f:68:6c:fc:56)
Internet Protocol Version 4, Src: 192.168.137.253 (192.168.137.253), Dst: 54.192.97.234 (54.192.97.234)
Transmission Control Protocol, Src Port: 58832 (58832), Dst Port: 443 (443), Seq: 101, Ack: 2737, Len: 0

No.     Time           Source                Destination           Protocol 
     20 1.490662000    192.168.137.253       54.192.97.234         TCP

Frame 20: 66 bytes on wire (528 bits), 66 bytes captured (528 bits) on interface 0
Ethernet II, Src: Apple_bb:b5:24 (9c:f3:87:bb:b5:24), Dst: 16:2f:68:6c:fc:56 (16:2f:68:6c:fc:56)
Internet Protocol Version 4, Src: 192.168.137.253 (192.168.137.253), Dst: 54.192.97.234 (54.192.97.234)
Transmission Control Protocol, Src Port: 58832 (58832), Dst Port: 443 (443), Seq: 101, Ack: 2996, Len: 0

No.     Time           Source                Destination           Protocol 
     21 1.499263000    192.168.137.253       54.192.97.234         TLSv1

Frame 21: 200 bytes on wire (1600 bits), 200 bytes captured (1600 bits) on interface 0
Ethernet II, Src: Apple_bb:b5:24 (9c:f3:87:bb:b5:24), Dst: 16:2f:68:6c:fc:56 (16:2f:68:6c:fc:56)
Internet Protocol Version 4, Src: 192.168.137.253 (192.168.137.253), Dst: 54.192.97.234 (54.192.97.234)
Transmission Control Protocol, Src Port: 58832 (58832), Dst Port: 443 (443), Seq: 101, Ack: 2996, Len: 134
Secure Sockets Layer

No.     Time           Source                Destination           Protocol 
     22 1.534812000    54.192.97.234         192.168.137.253       TLSv1

Frame 22: 316 bytes on wire (2528 bits), 316 bytes captured (2528 bits) on interface 0
Ethernet II, Src: 16:2f:68:6c:fc:56 (16:2f:68:6c:fc:56), Dst: Apple_bb:b5:24 (9c:f3:87:bb:b5:24)
Internet Protocol Version 4, Src: 54.192.97.234 (54.192.97.234), Dst: 192.168.137.253 (192.168.137.253)
Transmission Control Protocol, Src Port: 443 (443), Dst Port: 58832 (58832), Seq: 2996, Ack: 235, Len: 250
Secure Sockets Layer

No.     Time           Source                Destination           Protocol 
     23 1.534908000    192.168.137.253       54.192.97.234         TCP

Frame 23: 66 bytes on wire (528 bits), 66 bytes captured (528 bits) on interface 0
Ethernet II, Src: Apple_bb:b5:24 (9c:f3:87:bb:b5:24), Dst: 16:2f:68:6c:fc:56 (16:2f:68:6c:fc:56)
Internet Protocol Version 4, Src: 192.168.137.253 (192.168.137.253), Dst: 54.192.97.234 (54.192.97.234)
Transmission Control Protocol, Src Port: 58832 (58832), Dst Port: 443 (443), Seq: 235, Ack: 3246, Len: 0

No.     Time           Source                Destination           Protocol 
     24 1.536505000    192.168.137.253       54.192.97.234         TLSv1

Frame 24: 476 bytes on wire (3808 bits), 476 bytes captured (3808 bits) on interface 0
Ethernet II, Src: Apple_bb:b5:24 (9c:f3:87:bb:b5:24), Dst: 16:2f:68:6c:fc:56 (16:2f:68:6c:fc:56)
Internet Protocol Version 4, Src: 192.168.137.253 (192.168.137.253), Dst: 54.192.97.234 (54.192.97.234)
Transmission Control Protocol, Src Port: 58832 (58832), Dst Port: 443 (443), Seq: 235, Ack: 3246, Len: 410
Secure Sockets Layer

No.     Time           Source                Destination           Protocol 
     25 1.603055000    54.192.97.234         192.168.137.253       TCP

Frame 25: 66 bytes on wire (528 bits), 66 bytes captured (528 bits) on interface 0
Ethernet II, Src: 16:2f:68:6c:fc:56 (16:2f:68:6c:fc:56), Dst: Apple_bb:b5:24 (9c:f3:87:bb:b5:24)
Internet Protocol Version 4, Src: 54.192.97.234 (54.192.97.234), Dst: 192.168.137.253 (192.168.137.253)
Transmission Control Protocol, Src Port: 443 (443), Dst Port: 58832 (58832), Seq: 3246, Ack: 645, Len: 0

No.     Time           Source                Destination           Protocol 
     26 1.842567000    54.192.97.234         192.168.137.253       TCP

Frame 26: 1434 bytes on wire (11472 bits), 1434 bytes captured (11472 bits) on interface 0
Ethernet II, Src: 16:2f:68:6c:fc:56 (16:2f:68:6c:fc:56), Dst: Apple_bb:b5:24 (9c:f3:87:bb:b5:24)
Internet Protocol Version 4, Src: 54.192.97.234 (54.192.97.234), Dst: 192.168.137.253 (192.168.137.253)
Transmission Control Protocol, Src Port: 443 (443), Dst Port: 58832 (58832), Seq: 3246, Ack: 645, Len: 1368

No.     Time           Source                Destination           Protocol 
     27 1.843032000    54.192.97.234         192.168.137.253       TLSv1

Frame 27: 1295 bytes on wire (10360 bits), 1295 bytes captured (10360 bits) on interface 0
Ethernet II, Src: 16:2f:68:6c:fc:56 (16:2f:68:6c:fc:56), Dst: Apple_bb:b5:24 (9c:f3:87:bb:b5:24)
Internet Protocol Version 4, Src: 54.192.97.234 (54.192.97.234), Dst: 192.168.137.253 (192.168.137.253)
Transmission Control Protocol, Src Port: 443 (443), Dst Port: 58832 (58832), Seq: 4614, Ack: 645, Len: 1229
[2 Reassembled TCP Segments (2597 bytes): #26(1368), #27(1229)]
Secure Sockets Layer

No.     Time           Source                Destination           Protocol 
     28 1.843034000    54.192.97.234         192.168.137.253       TLSv1

Frame 28: 103 bytes on wire (824 bits), 103 bytes captured (824 bits) on interface 0
Ethernet II, Src: 16:2f:68:6c:fc:56 (16:2f:68:6c:fc:56), Dst: Apple_bb:b5:24 (9c:f3:87:bb:b5:24)
Internet Protocol Version 4, Src: 54.192.97.234 (54.192.97.234), Dst: 192.168.137.253 (192.168.137.253)
Transmission Control Protocol, Src Port: 443 (443), Dst Port: 58832 (58832), Seq: 5843, Ack: 645, Len: 37
Secure Sockets Layer

No.     Time           Source                Destination           Protocol 
     29 1.843133000    192.168.137.253       54.192.97.234         TCP

Frame 29: 66 bytes on wire (528 bits), 66 bytes captured (528 bits) on interface 0
Ethernet II, Src: Apple_bb:b5:24 (9c:f3:87:bb:b5:24), Dst: 16:2f:68:6c:fc:56 (16:2f:68:6c:fc:56)
Internet Protocol Version 4, Src: 192.168.137.253 (192.168.137.253), Dst: 54.192.97.234 (54.192.97.234)
Transmission Control Protocol, Src Port: 58832 (58832), Dst Port: 443 (443), Seq: 645, Ack: 5843, Len: 0

No.     Time           Source                Destination           Protocol 
     30 1.843134000    192.168.137.253       54.192.97.234         TCP

Frame 30: 66 bytes on wire (528 bits), 66 bytes captured (528 bits) on interface 0
Ethernet II, Src: Apple_bb:b5:24 (9c:f3:87:bb:b5:24), Dst: 16:2f:68:6c:fc:56 (16:2f:68:6c:fc:56)
Internet Protocol Version 4, Src: 192.168.137.253 (192.168.137.253), Dst: 54.192.97.234 (54.192.97.234)
Transmission Control Protocol, Src Port: 58832 (58832), Dst Port: 443 (443), Seq: 645, Ack: 5880, Len: 0

No.     Time           Source                Destination           Protocol 
     31 2.251752000    192.168.137.1         192.168.137.255       DB-LSP-DISC

Frame 31: 224 bytes on wire (1792 bits), 224 bytes captured (1792 bits) on interface 0
Ethernet II, Src: 16:2f:68:6c:fc:56 (16:2f:68:6c:fc:56), Dst: Broadcast (ff:ff:ff:ff:ff:ff)
Internet Protocol Version 4, Src: 192.168.137.1 (192.168.137.1), Dst: 192.168.137.255 (192.168.137.255)
User Datagram Protocol, Src Port: 17500 (17500), Dst Port: 17500 (17500)
Dropbox LAN sync Discovery Protocol

No.     Time           Source                Destination           Protocol 
     32 4.156651000    192.168.137.253       65.55.223.45          UDP

Frame 32: 191 bytes on wire (1528 bits), 191 bytes captured (1528 bits) on interface 0
Ethernet II, Src: Apple_bb:b5:24 (9c:f3:87:bb:b5:24), Dst: 16:2f:68:6c:fc:56 (16:2f:68:6c:fc:56)
Internet Protocol Version 4, Src: 192.168.137.253 (192.168.137.253), Dst: 65.55.223.45 (65.55.223.45)
User Datagram Protocol, Src Port: 64973 (64973), Dst Port: 40001 (40001)
Data (149 bytes)

0000  18 33 02 39 6e e4 4b d0 cb b7 dc 59 14 9f 2a 83   .3.9n.K....Y..*.
0010  47 07 55 db ce 72 a1 8e be 23 7a 98 c9 db 3e 16   G.U..r...#z...>.
0020  48 51 90 ae 9f a8 57 d2 b1 94 16 c5 0b 00 0c 2d   HQ....W........-
0030  45 15 73 fa 8e 21 5d 15 44 16 b2 3f 82 ce 2e ed   E.s..!].D..?....
0040  a2 15 dc df 59 19 fb cf a4 6d 2b bb 0b 21 1a 0d   ....Y....m+..!..
0050  e7 df c1 be f6 b3 85 e9 f4 bf 13 ba 73 bf 1e f8   ............s...
0060  c6 00 70 e3 22 7a 72 ae 99 8f 68 38 65 7e fa 01   ..p."zr...h8e~..
0070  a2 7c 1a 6e 82 ad 23 6f ee c5 29 21 dc 85 af 9a   .|.n..#o..)!....
0080  c6 73 ce fd 75 24 fb fc 91 7f b0 48 10 da 72 99   .s..u$.....H..r.
0090  fb 50 40 f0 13                                    .P@..

No.     Time           Source                Destination           Protocol 
     33 4.156808000    192.168.137.253       157.55.235.170        UDP

Frame 33: 193 bytes on wire (1544 bits), 193 bytes captured (1544 bits) on interface 0
Ethernet II, Src: Apple_bb:b5:24 (9c:f3:87:bb:b5:24), Dst: 16:2f:68:6c:fc:56 (16:2f:68:6c:fc:56)
Internet Protocol Version 4, Src: 192.168.137.253 (192.168.137.253), Dst: 157.55.235.170 (157.55.235.170)
User Datagram Protocol, Src Port: 64973 (64973), Dst Port: 40029 (40029)
Data (151 bytes)

0000  18 35 02 83 af e1 80 a5 95 f5 02 21 bb 0c 9a 91   .5.........!....
0010  12 3d 07 bf 33 5d 8b 41 8c 80 bc 3e e8 ce 54 dd   .=..3].A...>..T.
0020  5e f3 46 64 a6 18 95 d0 69 c8 e0 f3 7a 68 46 36   ^.Fd....i...zhF6
0030  f9 d2 76 87 eb 24 32 9a 70 6c b6 45 62 43 ec ea   ..v..$2.pl.EbC..
0040  2e 1e 90 6e 03 4b 46 3d d1 7b 09 93 fb e5 bb f3   ...n.KF=.{......
0050  20 d2 68 ca b0 d0 a2 3b 2e b1 07 0a e0 45 cb e9    .h....;.....E..
0060  24 76 70 7f 7a d4 ed cf 7d 97 bd a6 2c 9c ff 45   $vp.z...}...,..E
0070  6a 57 6b b8 7e a8 35 37 3a cf d5 a8 ff a3 f9 c9   jWk.~.57:.......
0080  d5 ac ad 3d dd 5c 75 a6 51 e5 2a 67 8e 8b 20 2b   ...=.\u.Q.*g.. +
0090  f2 1a 2c 24 5c b5 86                              ..,$\..

No.     Time           Source                Destination           Protocol 
     34 4.224925000    157.55.235.170        192.168.137.253       UDP

Frame 34: 63 bytes on wire (504 bits), 63 bytes captured (504 bits) on interface 0
Ethernet II, Src: 16:2f:68:6c:fc:56 (16:2f:68:6c:fc:56), Dst: Apple_bb:b5:24 (9c:f3:87:bb:b5:24)
Internet Protocol Version 4, Src: 157.55.235.170 (157.55.235.170), Dst: 192.168.137.253 (192.168.137.253)
User Datagram Protocol, Src Port: 40029 (40029), Dst Port: 64973 (64973)
Data (21 bytes)

0000  d5 e9 02 9b 72 dc b8 d8 69 00 f9 ce 3a 6d fb 05   ....r...i...:m..
0010  ea 9f 60 8a 49                                    ..`.I

No.     Time           Source                Destination           Protocol 
     35 4.285983000    65.55.223.45          192.168.137.253       UDP

Frame 35: 102 bytes on wire (816 bits), 102 bytes captured (816 bits) on interface 0
Ethernet II, Src: 16:2f:68:6c:fc:56 (16:2f:68:6c:fc:56), Dst: Apple_bb:b5:24 (9c:f3:87:bb:b5:24)
Internet Protocol Version 4, Src: 65.55.223.45 (65.55.223.45), Dst: 192.168.137.253 (192.168.137.253)
User Datagram Protocol, Src Port: 40001 (40001), Dst Port: 64973 (64973)
Data (60 bytes)

0000  ac 18 02 fa f9 e1 21 fc 48 13 60 fb 3f ea 60 8e   ......!.H.`.?.`.
0010  0d 86 7d d9 19 d8 b5 53 cd 93 7a 73 a6 db 18 33   ..}....S..zs...3
0020  3a 59 fe f5 78 a2 20 45 48 86 24 46 5e 27 7c 1f   :Y..x. EH.$F^'|.
0030  0f 85 6f 32 a1 6b b1 57 9a b8 ed 30               ..o2.k.W...0

No.     Time           Source                Destination           Protocol 
     36 5.529795000    108.160.162.107       192.168.137.253       TLSv1

Frame 36: 391 bytes on wire (3128 bits), 391 bytes captured (3128 bits) on interface 0
Ethernet II, Src: 16:2f:68:6c:fc:56 (16:2f:68:6c:fc:56), Dst: Apple_bb:b5:24 (9c:f3:87:bb:b5:24)
Internet Protocol Version 4, Src: 108.160.162.107 (108.160.162.107), Dst: 192.168.137.253 (192.168.137.253)
Transmission Control Protocol, Src Port: 443 (443), Dst Port: 57920 (57920), Seq: 1, Ack: 1, Len: 325
Secure Sockets Layer

No.     Time           Source                Destination           Protocol 
     37 5.529890000    192.168.137.253       108.160.162.107       TCP

Frame 37: 66 bytes on wire (528 bits), 66 bytes captured (528 bits) on interface 0
Ethernet II, Src: Apple_bb:b5:24 (9c:f3:87:bb:b5:24), Dst: 16:2f:68:6c:fc:56 (16:2f:68:6c:fc:56)
Internet Protocol Version 4, Src: 192.168.137.253 (192.168.137.253), Dst: 108.160.162.107 (108.160.162.107)
Transmission Control Protocol, Src Port: 57920 (57920), Dst Port: 443 (443), Seq: 1, Ack: 326, Len: 0

No.     Time           Source                Destination           Protocol 
     38 5.533252000    192.168.137.253       108.160.162.107       TLSv1

Frame 38: 460 bytes on wire (3680 bits), 460 bytes captured (3680 bits) on interface 0
Ethernet II, Src: Apple_bb:b5:24 (9c:f3:87:bb:b5:24), Dst: 16:2f:68:6c:fc:56 (16:2f:68:6c:fc:56)
Internet Protocol Version 4, Src: 192.168.137.253 (192.168.137.253), Dst: 108.160.162.107 (108.160.162.107)
Transmission Control Protocol, Src Port: 57920 (57920), Dst Port: 443 (443), Seq: 1, Ack: 326, Len: 394
Secure Sockets Layer

No.     Time           Source                Destination           Protocol 
     39 5.734815000    108.160.162.107       192.168.137.253       TCP

Frame 39: 66 bytes on wire (528 bits), 66 bytes captured (528 bits) on interface 0
Ethernet II, Src: 16:2f:68:6c:fc:56 (16:2f:68:6c:fc:56), Dst: Apple_bb:b5:24 (9c:f3:87:bb:b5:24)
Internet Protocol Version 4, Src: 108.160.162.107 (108.160.162.107), Dst: 192.168.137.253 (192.168.137.253)
Transmission Control Protocol, Src Port: 443 (443), Dst Port: 57920 (57920), Seq: 326, Ack: 395, Len: 0
